{
  "schema_version": 2, "resource_kind": "form", "resource_id": "us.ca4.form.civil-notice-of-appeal",
  "filing_id": "us.ca4.filing.civil-notice-of-appeal", "title": "Civil Notice of Appeal",
  "fields": [
    {"field_id": "us.ca4.field.civil-notice.caption", "label": "Case caption", "value_type": "short_text", "required": true},
    {"field_id": "us.ca4.field.civil-notice.appealing-parties", "label": "Party or parties taking the appeal", "value_type": "long_text", "required": true},
    {"field_id": "us.ca4.field.civil-notice.originating-docket", "label": "Originating docket number", "value_type": "short_text", "required": true},
    {"field_id": "us.ca4.field.civil-notice.judgment-or-order", "label": "Judgment or appealable order designated for review", "value_type": "long_text", "required": true},
    {"field_id": "us.ca4.field.civil-notice.order-date", "label": "Date of judgment or order appealed from", "value_type": "date", "required": true},
    {"field_id": "us.ca4.field.civil-notice.destination-court", "label": "Court to which the appeal is taken", "value_type": "short_text", "required": true}
  ]
}
